{
  "claimPlausible" : 500.0,
  "statementReason" : "Technical factor too high",
  "billingId" : "B123456789",
  "bpnlProperty" : "BPNL0123456789ZZ",
  "qualityTaskId" : "430f56d3-1234-1234-1234-abc123456789",
  "agreedTechnicalFactor" : 50,
  "statementDate" : "2025-02-13",
  "claimId" : "a214-13d6",
  "claimImplausible" : 500.0,
  "anonymizedVIN" : "3747429FGH382923974682",
  "billingStatus" : "approved",
  "billingDate" : "2025-02-13",
  "debitValueJustified" : true,
  "billedCurrency" : "EUR",
  "vehicleId" : "urn:uuid:580d3adf-1981-44a0-a214-13d6ceed9379"
}